{
  "id": "scene_nuova",
  "background": "camping.png",
  "background_scale": 1.0,
  "objects": [
    {
      "catalog_id": "ca_book_stack_adv",
      "x": 64,
      "y": 1793,
      "detection_type": "rect",
      "layer": "objects_mid",
      "is_goal": true,
      "hint_delay": 30,
      "width": 355,
      "height": 290
    },
    {
      "catalog_id": "ca_rope_coil_small",
      "x": 592,
      "y": 92,
      "detection_type": "circle",
      "layer": "objects_mid",
      "is_goal": true,
      "hint_delay": 25,
      "radius": 87,
      "width": 174,
      "height": 174
    },
    {
      "catalog_id": "ca_map_folded_small",
      "x": 988,
      "y": 1421,
      "detection_type": "circle",
      "layer": "objects_mid",
      "is_goal": true,
      "hint_delay": 20,
      "radius": 90,
      "width": 180,
      "height": 180
    },
    {
      "catalog_id": "ca_compass_brass",
      "x": 577,
      "y": 1932,
      "detection_type": "circle",
      "layer": "objects_mid",
      "is_goal": true,
      "hint_delay": 25,
      "radius": 97,
      "width": 194,
      "height": 194
    },
    {
      "catalog_id": "ca_notebook_small",
      "x": 1666,
      "y": 2196,
      "detection_type": "circle",
      "layer": "objects_mid",
      "is_goal": true,
      "hint_delay": 30,
      "radius": 97,
      "width": 194,
      "height": 194
    },
    {
      "catalog_id": "ca_swiss_knife",
      "x": 2895,
      "y": 1964,
      "detection_type": "rect",
      "layer": "objects_mid",
      "is_goal": true,
      "hint_delay": 35,
      "width": 109,
      "height": 98,
      "rotation": 270.1
    },
    {
      "catalog_id": "ca_toothbrush",
      "x": 3039,
      "y": 1944,
      "detection_type": "rect",
      "layer": "objects_mid",
      "is_goal": true,
      "hint_delay": 20,
      "width": 36,
      "height": 127
    },
    {
      "catalog_id": "ca_teddy_bear",
      "x": 2546,
      "y": 1056,
      "detection_type": "rect",
      "layer": "objects_mid",
      "is_goal": true,
      "hint_delay": 40,
      "width": 116,
      "height": 164
    },
    {
      "catalog_id": "ca_seashell",
      "x": 1297,
      "y": 1891,
      "detection_type": "circle",
      "layer": "objects_mid",
      "is_goal": true,
      "hint_delay": 35,
      "radius": 54.25,
      "width": 124,
      "height": 93
    },
    {
      "catalog_id": "ca_sleeping_bag_rolled",
      "x": 3784,
      "y": 1787,
      "detection_type": "rect",
      "layer": "objects_mid",
      "is_goal": true,
      "hint_delay": 30,
      "width": 240,
      "height": 184
    }
  ],
  "effects": [
    {
      "effect_id": "golden_glint",
      "type": "glint",
      "x": 4531,
      "y": 1931,
      "radius": 321,
      "intensity": 0.75,
      "layer": "effects",
      "layer_z": 100,
      "width": 300,
      "height": 180
    }
  ],
  "music": [],
  "flashlight": false,
  "flashlight_radius": 150.0,
  "name_key": "scene_nuova_name",
  "layer_locked": {
    "objects_low": false,
    "objects_mid": false,
    "objects_high": false,
    "overlay": false,
    "effects": false
  }
}