{
  "id": "Villa_Rosa",
  "background": "background.png",
  "background_scale": 1.0,
  "objects": [
    {
      "catalog_id": "leather_holster",
      "x": 1242,
      "y": 802,
      "detection_type": "rect",
      "layer": "objects_mid",
      "hint_delay": 30,
      "width": 114,
      "height": 121,
      "is_goal": true,
      "rotation": 349.8,
      "color_filter": [
        80,
        128,
        144
      ]
    },
    {
      "catalog_id": "tamer_whip",
      "x": 330,
      "y": 729,
      "detection_type": "circle",
      "layer": "objects_mid",
      "hint_delay": 40,
      "radius": 27,
      "is_goal": false,
      "color_filter": [
        80,
        128,
        144
      ]
    },
    {
      "catalog_id": "gameboy",
      "x": 729,
      "y": 662,
      "detection_type": "rect",
      "layer": "objects_mid",
      "hint_delay": 35,
      "width": 17,
      "height": 32,
      "is_goal": true,
      "rotation": 348.8,
      "color_filter": [
        80,
        128,
        144
      ],
      "alpha": 234
    },
    {
      "catalog_id": "popcorn_box",
      "x": 185,
      "y": 614,
      "detection_type": "rect",
      "layer": "objects_mid",
      "hint_delay": 30,
      "width": 36,
      "height": 43,
      "is_goal": false,
      "color_filter": [
        80,
        128,
        144
      ]
    },
    {
      "catalog_id": "top_hat",
      "x": 135,
      "y": 591,
      "detection_type": "rect",
      "layer": "objects_mid",
      "hint_delay": 30,
      "width": 36,
      "height": 39,
      "is_goal": false,
      "rotation": 350.4,
      "color_filter": [
        80,
        128,
        144
      ]
    },
    {
      "catalog_id": "walkman",
      "x": 216,
      "y": 704,
      "detection_type": "rect",
      "layer": "objects_mid",
      "hint_delay": 30,
      "width": 37,
      "height": 32,
      "is_goal": false,
      "color_filter": [
        80,
        128,
        144
      ],
      "rotation": 3.3
    },
    {
      "catalog_id": "hammer",
      "x": 598,
      "y": 782,
      "detection_type": "rect",
      "layer": "objects_mid",
      "hint_delay": 30,
      "width": 42,
      "height": 99,
      "is_goal": true,
      "alpha": 244,
      "color_filter": [
        148,
        188,
        202
      ]
    },
    {
      "catalog_id": "rubber_duck",
      "x": 1600,
      "y": 741,
      "detection_type": "circle",
      "layer": "objects_mid",
      "hint_delay": 25,
      "radius": 17.25,
      "is_goal": true,
      "width": 34,
      "height": 35,
      "alpha": 231,
      "color_filter": [
        149,
        203,
        222
      ]
    },
    {
      "catalog_id": "poison_mushroom",
      "x": 554,
      "y": 935,
      "detection_type": "circle",
      "layer": "objects_mid",
      "hint_delay": 30,
      "radius": 32,
      "is_goal": false,
      "color_filter": [
        80,
        128,
        144
      ]
    },
    {
      "catalog_id": "poison_mushroom",
      "x": 593,
      "y": 956,
      "detection_type": "circle",
      "layer": "objects_mid",
      "hint_delay": 30,
      "radius": 40,
      "is_goal": false,
      "color_filter": [
        80,
        128,
        144
      ]
    },
    {
      "catalog_id": "spirit_level",
      "x": 1004,
      "y": 421,
      "detection_type": "rect",
      "layer": "objects_mid",
      "hint_delay": 35,
      "width": 92,
      "height": 94,
      "is_goal": true,
      "rotation": 312.6,
      "color_filter": [
        141,
        141,
        141
      ]
    },
    {
      "catalog_id": "bucket",
      "x": 203,
      "y": 693,
      "detection_type": "circle",
      "layer": "objects_mid",
      "hint_delay": 30,
      "radius": 21.75,
      "is_goal": false,
      "width": 41,
      "height": 46,
      "color_filter": [
        80,
        128,
        144
      ],
      "grayscale": true
    },
    {
      "catalog_id": "old_syringe",
      "x": 257,
      "y": 141,
      "detection_type": "rect",
      "layer": "objects_mid",
      "hint_delay": 35,
      "width": 99,
      "height": 107,
      "is_goal": true,
      "rotation": 286.5,
      "alpha": 236,
      "color_filter": [
        118,
        155,
        193
      ]
    },
    {
      "catalog_id": "flintlock_pistol",
      "x": 79,
      "y": 321,
      "detection_type": "rect",
      "layer": "objects_mid",
      "hint_delay": 45,
      "width": 128,
      "height": 67,
      "is_goal": true,
      "rotation": 270.4,
      "color_filter": [
        74,
        102,
        74
      ]
    },
    {
      "catalog_id": "chainsaw_engine",
      "x": 1600,
      "y": 777,
      "detection_type": "rect",
      "layer": "objects_mid",
      "is_goal": true,
      "hint_delay": 40,
      "width": 169,
      "height": 67,
      "rotation": 359.9,
      "color_filter": [
        48,
        80,
        96
      ]
    }
  ],
  "effects": [
    {
      "effect_id": "golden_glint",
      "type": "glint",
      "x": 722,
      "y": 239,
      "radius": 174,
      "intensity": 0.17,
      "pulse_period": 4.57,
      "layer": "effects"
    },
    {
      "effect_id": "flies_swarm",
      "type": "flies",
      "x": 724,
      "y": 241,
      "radius": 111,
      "color": [
        20,
        20,
        20
      ],
      "intensity": 0.09,
      "pulse_period": 0.25,
      "pulse_min": 0.8,
      "layer": "effects"
    },
    {
      "effect_id": "chimney_smoke",
      "type": "smoke",
      "x": 73,
      "y": 410,
      "radius": 64.8,
      "color": [
        100,
        100,
        105
      ],
      "intensity": 0.33,
      "pulse_period": 0.1,
      "pulse_min": 2.2,
      "layer": "effects",
      "layer_z": 40
    },
    {
      "effect_id": "chimney_smoke",
      "type": "smoke",
      "x": 430,
      "y": 151,
      "radius": 77.2,
      "color": [
        100,
        100,
        105
      ],
      "intensity": 0.46,
      "pulse_period": 0.1,
      "pulse_min": 0.3,
      "layer": "effects",
      "layer_z": 40
    },
    {
      "effect_id": "chimney_smoke",
      "type": "smoke",
      "x": 1854,
      "y": 655,
      "radius": 38.0,
      "color": [
        100,
        100,
        105
      ],
      "intensity": 0.8,
      "pulse_period": 0.1,
      "pulse_min": 0.3,
      "layer": "effects",
      "layer_z": 40
    }
  ],
  "music": [],
  "flashlight": false,
  "flashlight_radius": 150.0,
  "layer_locked": {
    "objects_low": false,
    "objects_mid": false,
    "objects_high": false,
    "overlay": false,
    "effects": false
  }
}