{
  "id": "Pizza_King",
  "background": "background.png",
  "background_scale": 1.46,
  "objects": [
    {
      "catalog_id": "flag_peru",
      "x": 3164,
      "y": 1284,
      "detection_type": "rect",
      "layer": "objects_mid",
      "hint_delay": 35,
      "width": 124,
      "height": 128,
      "is_goal": true,
      "color_filter": [
        80,
        80,
        64
      ],
      "alpha": 222
    },
    {
      "catalog_id": "flag_ecuador",
      "x": 1668,
      "y": 1534,
      "detection_type": "rect",
      "layer": "objects_mid",
      "hint_delay": 35,
      "width": 160,
      "height": 156,
      "is_goal": false,
      "alpha": 198,
      "color_filter": [
        153,
        141,
        141
      ]
    },
    {
      "catalog_id": "flag_paraguay",
      "x": 479,
      "y": 956,
      "detection_type": "rect",
      "layer": "objects_mid",
      "hint_delay": 35,
      "width": 151,
      "height": 139,
      "is_goal": true,
      "alpha": 117,
      "color_filter": [
        165,
        180,
        108
      ]
    },
    {
      "catalog_id": "poison_bottle",
      "x": 1740,
      "y": 1756,
      "detection_type": "rect",
      "layer": "scene_global",
      "hint_delay": 35,
      "width": 51,
      "height": 104,
      "is_goal": true,
      "alpha": 180
    },
    {
      "catalog_id": "ouija_planchette",
      "x": 1537,
      "y": 643,
      "detection_type": "rect",
      "layer": "scene_global",
      "hint_delay": 25,
      "width": 111,
      "height": 126,
      "is_goal": true,
      "alpha": 184
    },
    {
      "catalog_id": "severed_finger",
      "x": 1840,
      "y": 1862,
      "detection_type": "rect",
      "layer": "scene_global",
      "hint_delay": 30,
      "width": 86,
      "height": 76,
      "is_goal": true,
      "alpha": 201
    },
    {
      "catalog_id": "bone_dice",
      "x": 1145,
      "y": 1907,
      "detection_type": "rect",
      "layer": "scene_global",
      "hint_delay": 30,
      "width": 135,
      "height": 127,
      "is_goal": true,
      "alpha": 181,
      "color_filter": [
        139,
        156,
        174
      ]
    },
    {
      "catalog_id": "mummified_hand",
      "x": 3047,
      "y": 1279,
      "detection_type": "rect",
      "layer": "scene_global",
      "hint_delay": 35,
      "width": 92,
      "height": 126,
      "is_goal": true,
      "alpha": 166
    },
    {
      "catalog_id": "pirate_symbol",
      "x": 1375,
      "y": 169,
      "detection_type": "rect",
      "layer": "scene_global",
      "hint_delay": 35,
      "width": 364,
      "height": 333,
      "is_goal": true,
      "corners": [
        [
          0,
          0
        ],
        [
          2,
          82
        ],
        [
          0,
          0
        ],
        [
          -21,
          -92
        ]
      ],
      "alpha": 68,
      "color_filter": [
        228,
        229,
        136
      ]
    },
    {
      "catalog_id": "vintage_desk_fan",
      "x": 957,
      "y": 1747,
      "detection_type": "circle",
      "layer": "scene_global",
      "hint_delay": 30,
      "radius": 126.0,
      "is_goal": true,
      "width": 239,
      "height": 265,
      "alpha": 196,
      "color_filter": [
        148,
        172,
        200
      ]
    },
    {
      "catalog_id": "tactical_fixed_knife",
      "x": 2195,
      "y": 975,
      "detection_type": "rect",
      "layer": "scene_global",
      "hint_delay": 35,
      "width": 226,
      "height": 49,
      "is_goal": true,
      "rotation": 269.4,
      "alpha": 232
    },
    {
      "catalog_id": "hourglass",
      "x": 2415,
      "y": 1323,
      "detection_type": "rect",
      "layer": "scene_global",
      "hint_delay": 40,
      "width": 154,
      "height": 242
    }
  ],
  "effects": [
    {
      "effect_id": "golden_glint",
      "type": "glint",
      "x": 603,
      "y": 693,
      "radius": 254,
      "intensity": 0.21,
      "layer": "effects",
      "layer_z": 40
    },
    {
      "effect_id": "golden_glint",
      "type": "glint",
      "x": 3206,
      "y": 1012,
      "radius": 76,
      "intensity": 0.24,
      "layer": "effects",
      "layer_z": 40
    },
    {
      "effect_id": "golden_glint",
      "type": "glint",
      "x": 1851,
      "y": 1066,
      "radius": 20,
      "color": [
        255,
        115,
        60
      ],
      "intensity": 3.0,
      "pulse_period": 3.72,
      "layer": "effects",
      "layer_z": 40
    },
    {
      "effect_id": "golden_glint",
      "type": "glint",
      "x": 1953,
      "y": 1079,
      "radius": 20,
      "color": [
        212,
        49,
        14
      ],
      "layer": "effects",
      "layer_z": 40
    },
    {
      "effect_id": "chimney_smoke",
      "type": "smoke",
      "x": 3586,
      "y": 664,
      "radius": 64.4,
      "color": [
        100,
        100,
        105
      ],
      "intensity": 1.34,
      "pulse_period": 0.59,
      "pulse_min": 0.3,
      "layer": "effects",
      "layer_z": 40
    }
  ],
  "music": [],
  "flashlight": false,
  "flashlight_radius": 150.0,
  "layer_locked": {
    "objects_low": false,
    "objects_mid": false,
    "objects_high": false,
    "overlay": false,
    "effects": false
  }
}